{"schema_version":1,"algorithm":"Ed25519","key_id":"sha256:9e061dd425ff7766f826911dec3502d6b8f1494705432da049ffed3c0fbe20bc","payload":"eyJzY2hlbWFfdmVyc2lvbiI6MSwibGlzdF92ZXJzaW9uIjoxLCJjYW5kaWRhdGVzIjpbeyJpZCI6Im1pY3Jvc29mdCIsImhvc3RuYW1lIjoid3d3Lm1pY3Jvc29mdC5jb20ifSx7ImlkIjoiYXBwbGUiLCJob3N0bmFtZSI6Ind3dy5hcHBsZS5jb20ifSx7ImlkIjoiY2xvdWRmbGFyZSIsImhvc3RuYW1lIjoid3d3LmNsb3VkZmxhcmUuY29tIn1dfQ","signature":"d8pyurCSyzTne0ArX1ERIs94kH-RkqdLcrnKQl_WEsyzUTooR7Wizdwj8OcrY4RbnnrkBBGBVpVHTO2pFVOGAA"}
